category;headline;authors;short_description
TRAVEL;How To Take The Ultimate Vacation In New Orleans;HuffPost Staff;A NOLA native shares her favorite restaurants, shops, scenic spots and places to relax in the Big Easy.
TRAVEL;Mistakes Tourists Make While Visiting New York City;Caroline BolognaSenior Reporter, HuffPost Life;Locals share the faux pas they often see visitors committing in the Big Apple.
TRAVEL;How Hotels Are Trying To Entice Travelers To Return;Caroline BolognaSenior Reporter, HuffPost Life;The pandemic increased interest in private vacation rentals, but that doesn't mean the end of traditional lodging.
TRAVEL;These Are Some Of The Best Places For Stargazing In The U.S.;Jillian WilsonWellness Reporter, HuffPost;Your own backyard is probably even on the list. Here's where to go and how to properly soak in the night sky.
TRAVEL;What To Do If An Airline Loses Your Luggage;Caroline BolognaSenior Reporter, HuffPost Life;Air travel experts share their advice for dealing with missing checked baggage — and minimizing the risk in the first place.
TRAVEL;How To Get Hotel Perks Without Paying A Ton;Caroline BolognaSenior Reporter, HuffPost Life;Experts share their advice for getting free upgrades, extra amenities and more.
WELLNESS;What Makes A 'Core Memory'?;Jillian WilsonWellness Reporter, HuffPost;Core memories aren't a real clinical concept, but there are things that fuel the creation of defining life events and experiences.
WELLNESS;11 Ways Parents Make Their Kids Feel Guilty Without Realizing It;Caroline BolognaSenior Reporter, HuffPost Life;Experts break down the comments and behaviors from adults that instill feelings of guilt in children.
WELLNESS;Uterine Fibroids Linked To Chemicals Found In Common Products;Julia RiesOn Assignment For HuffPost;Research suggests toxic chemicals from plastic used in many household and medical items could be causing hormonal health issues.
WELLNESS;How To Boost Endorphins Without Exercise;Jillian WilsonWellness Reporter, HuffPost;You might already be getting a “runner’s high” from these daily activities and didn’t realize it.
WELLNESS;When Did 'Hip Dips' Become A Thing To Get Rid Of?;Brittany WongSenior Lifestyle Reporter, HuffPost;Don't let social media fool you: There's nothing wrong with having 'hip dips' or ‘violin hips.'
WELLNESS;The New Heart Health Guidelines You Need To Know About;Jillian WilsonWellness Reporter, HuffPost;You can cut your risk of cardiovascular disease by following this advice from the American Heart Association.
WELLNESS;The Winter Means Lower Vitamin D. Here's How Much You Really Need.;Jillian WilsonWellness Reporter, HuffPost;Vitamin D is beneficial for your health — but only to a certain extent, according to experts.
WELLNESS;The Best Gym Shoes For Every Workout, According To Fitness Experts;Kristen AdawayShopping Writer at HuffPost;Get the most out of your workout session with these expert-picked footwear recommendations for women and men.
WELLNESS;These Desk Treadmills Are Perfect For Walking And Working;Lindsay HolmesSenior Wellness & Travel Editor, HuffPost;Reduce your number of sedentary hours with one of these walking pads. Your body and mind will thank you for it.
WELLNESS;Products For Waking Up Early, According To Actual Morning People;Griffin WynneStaff Writer;We talked to newscasters, lobstermen, bakers, baristas and other early birds about their morning routine hacks.
WELLNESS;Some Millennials And Older Generations Are 'Kidulting.' Maybe You Should, Too.;Brittany WongSenior Lifestyle Reporter, HuffPost;The mental health benefits of play and nostalgia are vastly underrated.
WELLNESS;If You Drink To Decompress During The Holidays, Try This Instead;Hilary SheinbaumOn Assignment For HuffPost;These booze-free habits can help you unwind this season (without the hangover).
WELLNESS;The Funniest (And Saddest) Tweets About Trying To Get Taylor Swift Tickets;Jillian WilsonWellness Reporter, HuffPost;Ticketmaster better sleep with one eye open, according to these Swifties.
WELLNESS;'I Felt Seen': Childless Women React To Jennifer Aniston's IVF Story;Marie HolmesParenting reporter;"The actor revealed she had a challenging journey on ""the baby-making road,"" giving voice to many who use fertility treatments but don't become parents."
WELLNESS;COVID, Flu Or RSV? Here's How To Tell The Difference.;Jillian WilsonWellness Reporter, HuffPost;It can be pretty hard to tell these circulating viruses apart, but experts share some tips for deciphering your symptoms.
WELLNESS;Does Cracking Your Knuckles Give You Arthritis?;Caroline BolognaSenior Reporter, HuffPost Life;Doctors weigh in on this common warning from parents.
WELLNESS;What To Do When You Have A Breakthrough In Therapy;Jillian WilsonWellness Reporter, HuffPost;"Experts share their advice on the steps you should take after you have a big realization or an ""aha"" moment during therapy."
WELLNESS;Paxlovid May Cut Your Risk Of Long COVID, New Study Shows;Julia RiesOn Assignment For HuffPost;The research found people who took the treatment experienced fewer long-term symptoms like fatigue or brain fog.
WELLNESS;Need Mental Health Help But You Aren't In Crisis? Try A 'Warmline';Ashley BroadwaterOn Assignment For HuffPost;Instead of using a hotline, this is a number you can call or text for free if you need to vent or be comforted. Here’s how it works.
WELLNESS;Do You Always Need Background Noise? There's A Psychological Reason Why.;Ashley BroadwaterOn Assignment For HuffPost;Therapists explain when the need for filler sound — like music or the TV — may indicate a mental health issue rather than a welcome distraction.
WELLNESS;You Probably Should Change Your Home's HVAC Filter Right Now;Jillian WilsonWellness Reporter, HuffPost;Here’s why it’s important to have a clean filter in your heating, ventilation and air conditioning system.
WELLNESS;COVID Superspreader Events Still Exist. Here's What They Look Like Now.;Julia RiesOn Assignment For HuffPost;Just because we don't hear about clusters of infections like we did in 2020 and 2021 doesn't mean they don't happen.
WELLNESS;The Most Common RSV Symptoms Doctors Are Seeing Right Now;Jillian WilsonWellness Reporter, HuffPost;Adults and children can both get the highly contagious respiratory syncytial virus. Here's what to know about symptoms in each age group.
WELLNESS;Study Finds Moderate And Heavy Drinking Linked To Stroke In Young Adults;Jillian WilsonWellness Reporter, HuffPost;Researchers followed 1.5 million people in their 20s and 30s to determine their risk of stroke if they frequently consume alcohol.
WELLNESS;Here's When You'll Get The Biggest Endorphin Release From Working Out;Jillian WilsonWellness Reporter, HuffPost;Experts share what exercises result in the biggest endorphin release and how long you need to work out to get there.
WELLNESS;7 Habits That Will Drastically Improve Your Energy Levels;Kyli Rodriguez-CayroOn Assignment For HuffPost;Feeling tired or hitting an afternoon slump? These simple lifestyle shifts can make a big difference.
WELLNESS;Men Get Real About Their Insecurities Over Their 'Man Boobs';Brittany WongSenior Lifestyle Reporter, HuffPost;"Living with gynecomastia — otherwise known as ""man boobs"" — can be an emotionally isolating experience. Here's how to cope."
WELLNESS;Standing Up Straight Might Not Be As Beneficial As We Thought;Jillian WilsonWellness Reporter, HuffPost;We’re told to stand up straight from a young age, but experts say there’s more to spinal health than good posture.
WELLNESS;How Discrimination Affects Your Mental And Physical Health;Jillian WilsonWellness Reporter, HuffPost;For members of marginalized communities, discrimination is not only unjust but physically and mentally harmful.
WELLNESS;10 Adult ADHD Signs You May Not Realize Are Actually Symptoms;Krissy BradyOn Assignment For HuffPost;Attention-deficit/hyperactivity disorder presents differently when you're older. Here are the red flags to look for.
